Category,Domain,Goal,Plan,PlanSum,TextRank,GPT-4o
PDDL,"""blocks""",probBLOCKS-10-0.pddl.json,"['[""(unstack c e)"", ""(put-down c)"", ""(unstack e j)"", ""(stack e c)"", ""(unstack j b)"", ""(put-down j)"", ""(unstack b g)"", ""(put-down b)"", ""(unstack g h)"", ""(stack g e)"", ""(unstack h a)"", ""(put-down h)"", ""(unstack a d)"", ""(stack a h)"", ""(unstack d i)"", ""(put-down d)"", ""(unstack g e)"", ""(stack g i)"", ""(unstack a h)"", ""(stack a g)"", ""(pick-up b)"", ""(stack b a)"", ""(pick-up h)"", ""(stack h b)"", ""(unstack e c)"", ""(stack e h)"", ""(pick-up j)"", ""(stack j e)"", ""(pick-up f)"", ""(stack f j)"", ""(pick-up c)"", ""(stack c f)"", ""(pick-up d)"", ""(stack d c)""]', '[""(unstack c e)"", ""(put-down c)"", ""(unstack e j)"", ""(put-down e)"", ""(unstack j b)"", ""(stack j c)"", ""(unstack b g)"", ""(stack b f)"", ""(unstack g h)"", ""(put-down g)"", ""(unstack h a)"", ""(put-down h)"", ""(unstack a d)"", ""(stack a j)"", ""(unstack d i)"", ""(put-down d)"", ""(pick-up g)"", ""(stack g i)"", ""(unstack a j)"", ""(stack a g)"", ""(unstack b f)"", ""(stack b a)"", ""(pick-up h)"", ""(stack h b)"", ""(pick-up e)"", ""(stack e h)"", ""(unstack j c)"", ""(stack j e)"", ""(pick-up f)"", ""(stack f j)"", ""(pick-up c)"", ""(stack c f)"", ""(pick-up d)"", ""(stack d c)""]', '[""(unstack c e)"", ""(put-down c)"", ""(unstack e j)"", ""(stack e f)"", ""(unstack j b)"", ""(stack j c)"", ""(unstack b g)"", ""(put-down b)"", ""(unstack g h)"", ""(put-down g)"", ""(unstack h a)"", ""(stack h e)"", ""(unstack a d)"", ""(stack a b)"", ""(unstack d i)"", ""(put-down d)"", ""(pick-up g)"", ""(stack g i)"", ""(unstack a b)"", ""(stack a g)"", ""(pick-up b)"", ""(stack b a)"", ""(unstack h e)"", ""(stack h b)"", ""(unstack e f)"", ""(stack e h)"", ""(unstack j c)"", ""(stack j e)"", ""(pick-up f)"", ""(stack f j)"", ""(pick-up c)"", ""(stack c f)"", ""(pick-up d)"", ""(stack d c)""]', '[""(unstack c e)"", ""(put-down c)"", ""(unstack e j)"", ""(put-down e)"", ""(unstack j b)"", ""(put-down j)"", ""(unstack b g)"", ""(put-down b)"", ""(unstack g h)"", ""(stack g j)"", ""(unstack h a)"", ""(stack h c)"", ""(unstack a d)"", ""(put-down a)"", ""(unstack d i)"", ""(put-down d)"", ""(unstack g j)"", ""(stack g i)"", ""(pick-up a)"", ""(stack a g)"", ""(pick-up b)"", ""(stack b a)"", ""(unstack h c)"", ""(stack h b)"", ""(pick-up e)"", ""(stack e h)"", ""(pick-up j)"", ""(stack j e)"", ""(pick-up f)"", ""(stack f j)"", ""(pick-up c)"", ""(stack c f)"", ""(pick-up d)"", ""(stack d c)""]', '[""(unstack c e)"", ""(put-down c)"", ""(unstack e j)"", ""(put-down e)"", ""(unstack j b)"", ""(put-down j)"", ""(unstack b g)"", ""(stack b f)"", ""(unstack g h)"", ""(stack g c)"", ""(unstack h a)"", ""(stack h e)"", ""(unstack a d)"", ""(stack a b)"", ""(unstack d i)"", ""(put-down d)"", ""(unstack g c)"", ""(stack g i)"", ""(unstack a b)"", ""(stack a g)"", ""(unstack b f)"", ""(stack b a)"", ""(unstack h e)"", ""(stack h b)"", ""(pick-up e)"", ""(stack e h)"", ""(pick-up j)"", ""(stack j e)"", ""(pick-up f)"", ""(stack f j)"", ""(pick-up c)"", ""(stack c f)"", ""(pick-up d)"", ""(stack d c)""]']","Analysis of 5 plans reveals an average of 34.00 steps per plan, with most common actions - stack (61 times), unstack (56 times) and most involved objects - e (36 times), c (35 times). The plan with the least number of steps is Plan: 1. The most common action sequence is: unstack c e -> put-down c -> unstack e j.","['(pick-up j)', '(pick-up c)', '(pick-up d)', '(pick-up f)', '(pick-up g)', '(put-down a)']","The five plans involve a series of actions to rearrange blocks. Despite variations in the order of actions, all plans achieve the same final configuration. Here are the key steps common across the plans, capturing the high-importance actions:

Initial Unstacking and Putting Down:

The initial steps across all plans involve unstacking blocks like (unstack c e), (unstack e j), and putting them down (put-down c), (put-down e).
Intermediate Stacking:

In various intermediate steps, blocks are stacked and unstacked to achieve the desired final configuration. For example, actions like (stack e c), (stack g i), and (stack h b) are common.
Final Stacking Sequence:

The final stacking sequence involves picking up blocks and stacking them in a specific order. This sequence includes actions such as (pick-up f), (stack f j), (pick-up c), (stack c f), and (pick-up d), (stack d c).
Key Actions Summary
Unstacking Initial Blocks:

(unstack c e), (unstack e j), (unstack j b), (unstack b g), (unstack g h), (unstack h a), (unstack a d), (unstack d i)
Intermediate Put-downs and Stacking:

(put-down c), (put-down e), (put-down j), (put-down b), (put-down g), (put-down d)
(stack e c), (stack j c), (stack b f), (stack g e), (stack h e), (stack a b), (stack g i), (stack a g), (stack b a), (stack h b), (stack e h), (stack j e)
Final Assembly:

(pick-up f), (stack f j)
(pick-up c), (stack c f)
(pick-up d), (stack d c)
These actions ensure that all blocks are eventually rearranged into the final desired configuration while maintaining efficiency and minimal redundant actions."
PDDL,"""blocks""",probBLOCKS-11-2.pddl.json,"['[""(unstack i e)"", ""(put-down i)"", ""(unstack b h)"", ""(put-down b)"", ""(unstack h k)"", ""(stack h b)"", ""(unstack k f)"", ""(put-down k)"", ""(unstack e g)"", ""(stack e g)"", ""(unstack f c)"", ""(stack f k)"", ""(unstack c d)"", ""(put-down c)"", ""(unstack d j)"", ""(put-down d)"", ""(unstack j a)"", ""(put-down j)"", ""(pick-up a)"", ""(stack a f)"", ""(unstack h b)"", ""(stack h a)"", ""(pick-up b)"", ""(stack b h)"", ""(pick-up j)"", ""(stack j b)"", ""(unstack e g)"", ""(stack e j)"", ""(pick-up d)"", ""(stack d e)"", ""(pick-up c)"", ""(stack c d)"", ""(pick-up g)"", ""(stack g c)"", ""(pick-up i)"", ""(stack i g)""]', '[""(unstack b h)"", ""(put-down b)"", ""(pick-up b)"", ""(put-down b)"", ""(unstack h k)"", ""(put-down h)"", ""(unstack k f)"", ""(put-down k)"", ""(unstack f c)"", ""(stack f k)"", ""(unstack c d)"", ""(put-down c)"", ""(unstack i e)"", ""(put-down i)"", ""(unstack d j)"", ""(put-down d)"", ""(unstack j a)"", ""(stack j i)"", ""(pick-up a)"", ""(stack a f)"", ""(pick-up h)"", ""(stack h a)"", ""(pick-up b)"", ""(stack b h)"", ""(unstack j i)"", ""(stack j b)"", ""(unstack e g)"", ""(stack e j)"", ""(pick-up d)"", ""(stack d e)"", ""(pick-up c)"", ""(stack c d)"", ""(pick-up g)"", ""(stack g c)"", ""(pick-up i)"", ""(stack i g)""]', '[""(unstack b h)"", ""(put-down b)"", ""(unstack h k)"", ""(put-down h)"", ""(unstack k f)"", ""(put-down k)"", ""(unstack i e)"", ""(put-down i)"", ""(unstack f c)"", ""(stack f k)"", ""(unstack c d)"", ""(put-down c)"", ""(unstack d j)"", ""(stack d c)"", ""(unstack e g)"", ""(stack e g)"", ""(unstack j a)"", ""(stack j i)"", ""(pick-up a)"", ""(stack a f)"", ""(pick-up h)"", ""(stack h a)"", ""(pick-up b)"", ""(stack b h)"", ""(unstack j i)"", ""(stack j b)"", ""(unstack e g)"", ""(stack e j)"", ""(unstack d c)"", ""(stack d e)"", ""(pick-up c)"", ""(stack c d)"", ""(pick-up g)"", ""(stack g c)"", ""(pick-up i)"", ""(stack i g)""]', '[""(unstack b h)"", ""(put-down b)"", ""(unstack h k)"", ""(put-down h)"", ""(unstack k f)"", ""(put-down k)"", ""(unstack f c)"", ""(stack f k)"", ""(unstack c d)"", ""(put-down c)"", ""(unstack d j)"", ""(stack d c)"", ""(unstack j a)"", ""(put-down j)"", ""(pick-up a)"", ""(put-down a)"", ""(pick-up a)"", ""(stack a f)"", ""(unstack i e)"", ""(put-down i)"", ""(pick-up h)"", ""(stack h a)"", ""(pick-up b)"", ""(stack b h)"", ""(pick-up j)"", ""(stack j b)"", ""(unstack e g)"", ""(stack e j)"", ""(unstack d c)"", ""(stack d e)"", ""(pick-up c)"", ""(stack c d)"", ""(pick-up g)"", ""(stack g c)"", ""(pick-up i)"", ""(stack i g)""]', '[""(unstack i e)"", ""(stack i e)"", ""(unstack i e)"", ""(stack i e)"", ""(unstack i e)"", ""(stack i e)"", ""(unstack i e)"", ""(stack i e)"", ""(unstack i e)"", ""(stack i e)"", ""(unstack i e)"", ""(stack i e)"", ""(unstack i e)"", ""(stack i e)"", ""(unstack i e)"", ""(stack i e)"", ""(unstack i e)"", ""(stack i e)"", ""(unstack i e)"", ""(stack i e)"", ""(unstack i e)"", ""(stack i e)"", ""(unstack i e)"", ""(stack i e)"", ""(unstack i e)"", ""(stack i e)"", ""(unstack b h)"", ""(put-down b)"", ""(unstack h k)"", ""(stack h i)"", ""(unstack k f)"", ""(put-down k)"", ""(unstack f c)"", ""(stack f k)"", ""(unstack c d)"", ""(put-down c)"", ""(unstack f k)"", ""(stack f k)"", ""(unstack d j)"", ""(stack d c)"", ""(unstack j a)"", ""(stack j d)"", ""(pick-up a)"", ""(stack a f)"", ""(unstack h i)"", ""(stack h a)"", ""(pick-up b)"", ""(stack b h)"", ""(unstack b h)"", ""(stack b h)"", ""(unstack j d)"", ""(stack j b)"", ""(unstack i e)"", ""(put-down i)"", ""(unstack e g)"", ""(stack e j)"", ""(unstack d c)"", ""(stack d e)"", ""(pick-up c)"", ""(stack c d)"", ""(pick-up g)"", ""(stack g c)"", ""(pick-up i)"", ""(stack i g)""]']","Analysis of 5 plans reveals an average of 41.60 steps per plan, with most common actions - stack (75 times), unstack (70 times) and most involved objects - i (52 times), e (50 times). The plan with the least number of steps is Plan: 1. The most common action sequence is: unstack i e -> stack i e -> unstack i e.","['(unstack f c)', '(pick-up j)', '(unstack b h)', '(pick-up c)', '(unstack d j)', '(unstack h i)']","Initial Unstacking and Placing:

Unstack various blocks (i, b, h, k, f, c, d, j, e) and place them down to free up blocks for rearrangement.
Intermediate Stacking and Rearranging:

Several intermediate stacking actions are used to create temporary configurations:
Stack h on b, f on k, e on g, j on i, d on c, a on f, and other intermediate stackings to facilitate the process.
Repeated Actions and Adjustments:

Actions like unstacking and restacking i on e are repeated multiple times.
Blocks h, b, and j are used repeatedly for various intermediate steps.
Final Stacking Sequence:

Stack d on e, c on d, g on c, and i on g to achieve the final goal state.
Ensure correct stacking of h on a, b on h, and j on b to finalize the arrangement.
Key Actions:

Initial Unstacking: Essential to free blocks from their initial positions.
Temporary Placements: Strategic stacking of blocks like h on b, f on k, and e on g for intermediate steps.
Final Stacking Sequence: Critical final steps to achieve the goal state, ensuring proper stack order for d, c, g, i, h, a, b, and j.
This summary captures the essence of the plans, highlighting the most important actions and ensuring the final goal is achieved efficiently."
PDDL,"""driverlog""",p01.pddl.json,"['[""(load-truck package2 truck2 s0)"", ""(walk driver1 s2 p1-2)"", ""(walk driver2 s2 p1-2)"", ""(walk driver2 p1-2 s1)"", ""(walk driver1 p1-2 s1)"", ""(walk driver2 s1 p1-0)"", ""(unload-truck package2 truck2 s0)"", ""(walk driver2 p1-0 s0)"", ""(board-truck driver2 truck1 s0)"", ""(drive-truck truck1 s0 s1 driver2)""]', '[""(load-truck package1 truck2 s0)"", ""(walk driver2 s2 p1-2)"", ""(walk driver1 s2 p1-2)"", ""(walk driver2 p1-2 s1)"", ""(walk driver1 p1-2 s1)"", ""(walk driver2 s1 p1-0)"", ""(walk driver2 p1-0 s0)"", ""(board-truck driver2 truck1 s0)"", ""(drive-truck truck1 s0 s1 driver2)"", ""(unload-truck package1 truck2 s0)""]', '[""(walk driver2 s2 p1-2)"", ""(walk driver2 p1-2 s1)"", ""(walk driver2 s1 p1-0)"", ""(walk driver1 s2 p1-2)"", ""(load-truck package2 truck2 s0)"", ""(unload-truck package2 truck2 s0)"", ""(walk driver2 p1-0 s0)"", ""(board-truck driver2 truck1 s0)"", ""(drive-truck truck1 s0 s1 driver2)"", ""(walk driver1 p1-2 s1)""]', '[""(walk driver2 s2 p1-2)"", ""(walk driver2 p1-2 s1)"", ""(load-truck package1 truck2 s0)"", ""(walk driver2 s1 p1-0)"", ""(walk driver2 p1-0 s0)"", ""(walk driver1 s2 p1-2)"", ""(unload-truck package1 truck2 s0)"", ""(board-truck driver2 truck1 s0)"", ""(drive-truck truck1 s0 s1 driver2)"", ""(walk driver1 p1-2 s1)""]', '[""(walk driver1 s2 p1-2)"", ""(load-truck package1 truck2 s0)"", ""(walk driver1 p1-2 s1)"", ""(walk driver2 s2 p1-2)"", ""(unload-truck package1 truck2 s0)"", ""(walk driver2 p1-2 s1)"", ""(walk driver2 s1 p1-0)"", ""(walk driver2 p1-0 s0)"", ""(board-truck driver2 truck1 s0)"", ""(drive-truck truck1 s0 s1 driver2)""]']","Analysis of 5 plans reveals an average of 10.00 steps per plan, with most common actions - walk (30 times), load-truck (5 times) and most involved objects - driver2 (30 times), s0 (25 times). The plan with the least number of steps is Plan: 1. The most common action sequence is: walk driver2 p1-0 s0 -> board-truck driver2 truck1 s0 -> drive-truck truck1 s0 s1 driver2.","['(walk driver2 p1-2 s1)', '(walk driver2 s1 p1-0)', '(walk driver2 p1-0 s0)', '(walk driver2 s2 p1-2)', '(walk driver1 p1-2 s1)', '(load-truck package2 truck2 s0)']","Loading and Unloading Packages:

Load package1 or package2 onto truck2 at location s0.
Unload package1 or package2 from truck2 at location s0 after completing other actions.
Driver Movements:

Walk driver1 and driver2 from s2 to p1-2, then to s1, and finally to p1-0.
Drivers move between these points multiple times to coordinate actions.
Truck Boarding and Driving:

Driver2 boards truck1 at location s0.
Driver2 drives truck1 from s0 to s1.
Key Actions:

Loading and Unloading: Load and unload actions for packages are consistently performed at location s0.
Driver Walking: Drivers walk through specific waypoints (s2, p1-2, s1, p1-0) to facilitate the operations.
Truck Operations: Boarding and driving of truck1 by driver2 from s0 to s1 is a critical step.
This summary captures the essential and recurring actions across all plans, ensuring a concise representation of the overall workflow."
PDDL,"""driverlog""",p06.pddl.json,"['[""(walk driver1 s2 p1-2)"", ""(walk driver2 s2 p1-2)"", ""(walk driver1 p1-2 s1)"", ""(load-truck package1 truck3 s1)"", ""(walk driver2 p1-2 s1)"", ""(board-truck driver2 truck2 s1)"", ""(board-truck driver3 truck3 s1)"", ""(drive-truck truck2 s1 s0 driver2)"", ""(disembark-truck driver2 truck2 s0)"", ""(drive-truck truck3 s1 s2 driver3)"", ""(unload-truck package1 truck3 s2)""]', '[""(walk driver1 s2 p1-2)"", ""(board-truck driver3 truck3 s1)"", ""(walk driver2 s2 p1-2)"", ""(walk driver2 p1-2 s1)"", ""(load-truck package1 truck3 s1)"", ""(drive-truck truck3 s1 s2 driver3)"", ""(walk driver1 p1-2 s1)"", ""(unload-truck package1 truck3 s2)"", ""(board-truck driver2 truck2 s1)"", ""(drive-truck truck2 s1 s0 driver2)"", ""(disembark-truck driver2 truck2 s0)""]', '[""(load-truck package1 truck3 s1)"", ""(walk driver2 s2 p1-2)"", ""(board-truck driver3 truck3 s1)"", ""(walk driver2 p1-2 s1)"", ""(walk driver1 s2 p1-2)"", ""(board-truck driver2 truck2 s1)"", ""(drive-truck truck3 s1 s2 driver3)"", ""(walk driver1 p1-2 s1)"", ""(drive-truck truck2 s1 s0 driver2)"", ""(unload-truck package1 truck3 s2)"", ""(disembark-truck driver2 truck2 s0)""]', '[""(walk driver2 s2 p1-2)"", ""(walk driver1 s2 p1-2)"", ""(walk driver1 p1-2 s1)"", ""(walk driver2 p1-2 s1)"", ""(board-truck driver2 truck2 s1)"", ""(drive-truck truck2 s1 s0 driver2)"", ""(load-truck package1 truck3 s1)"", ""(board-truck driver3 truck3 s1)"", ""(disembark-truck driver2 truck2 s0)"", ""(drive-truck truck3 s1 s2 driver3)"", ""(unload-truck package1 truck3 s2)""]', '[""(board-truck driver3 truck3 s1)"", ""(walk driver2 s2 p1-2)"", ""(walk driver2 p1-2 s1)"", ""(walk driver1 s2 p1-2)"", ""(load-truck package1 truck3 s1)"", ""(drive-truck truck3 s1 s2 driver3)"", ""(board-truck driver2 truck2 s1)"", ""(drive-truck truck2 s1 s0 driver2)"", ""(disembark-truck driver2 truck2 s0)"", ""(walk driver1 p1-2 s1)"", ""(unload-truck package1 truck3 s2)""]']","Analysis of 5 plans reveals an average of 11.00 steps per plan, with most common actions - walk (20 times), board-truck (10 times) and most involved objects - s1 (35 times), driver2 (25 times). The plan with the least number of steps is Plan: 1. The most common action sequence is: disembark-truck driver2 truck2 s0 -> drive-truck truck3 s1 s2 driver3 -> unload-truck package1 truck3 s2.","['(walk driver2 p1-2 s1)', '(board-truck driver2 truck2 s1)', '(drive-truck truck3 s1 s2 driver3)', '(walk driver2 s2 p1-2)', '(drive-truck truck2 s1 s0 driver2)', '(board-truck driver3 truck3 s1)']","Driver Movements:

Walk driver1 and driver2 from s2 to p1-2, then from p1-2 to s1.
Drivers make these movements to coordinate the loading and boarding actions.
Loading and Unloading Package:

Load package1 onto truck3 at location s1.
Unload package1 from truck3 at location s2.
Truck Boarding and Driving:

Driver2 boards truck2 at location s1 and drives it from s1 to s0, then disembarks.
Driver3 boards truck3 at location s1 and drives it from s1 to s2.
Key Actions:

Loading: Loading package1 onto truck3 at s1.
Unloading: Unloading package1 from truck3 at s2.
Driver Walking: Coordinated walking movements of drivers between s2, p1-2, and s1.
Truck Operations: Boarding, driving, and disembarking actions for truck2 and truck3 by driver2 and driver3 respectively.
This summary captures the essential actions and ensures the overall goal of moving the package is achieved efficiently."
PDDL,"""mprime""",prob01.pddl.json,"['[""(overcome abrasion rest pork uranus venus)"", ""(feast rest pork lamb alsace quebec)"", ""(feast rest lamb flounder surrey pennsylvania)"", ""(feast rest flounder rice pennsylvania alsace)"", ""(drink flounder pork pennsylvania surrey bosnia alsace quebec)"", ""(succumb abrasion rest rice uranus venus)"", ""(drink pear flounder surrey bosnia kentucky surrey pennsylvania)""]', '[""(overcome abrasion rest pork uranus venus)"", ""(feast rest pork okra alsace quebec)"", ""(feast rest okra pear quebec guanabara)"", ""(feast rest pear rice bosnia surrey)"", ""(succumb abrasion rest rice uranus venus)"", ""(drink pork rice alsace pennsylvania surrey bosnia surrey)"", ""(drink rice flounder surrey bosnia kentucky alsace quebec)""]', '[""(overcome abrasion rest pork uranus venus)"", ""(feast rest pork okra alsace quebec)"", ""(feast rest okra pear quebec guanabara)"", ""(feast rest pear rice bosnia surrey)"", ""(drink lamb okra pennsylvania surrey bosnia quebec guanabara)"", ""(succumb abrasion rest rice uranus venus)"", ""(drink okra rice guanabara quebec alsace bosnia surrey)""]', '[""(overcome abrasion rest pork uranus venus)"", ""(drink pork lamb quebec alsace pennsylvania pennsylvania alsace)"", ""(feast rest pork lamb pennsylvania alsace)"", ""(drink flounder pear alsace pennsylvania surrey surrey pennsylvania)"", ""(feast rest lamb flounder pennsylvania alsace)"", ""(feast rest flounder rice surrey pennsylvania)"", ""(succumb abrasion rest rice uranus venus)""]', '[""(overcome abrasion rest pork uranus venus)"", ""(feast rest pork okra alsace quebec)"", ""(feast rest okra pear quebec guanabara)"", ""(feast rest pear rice bosnia surrey)"", ""(succumb abrasion rest rice uranus venus)"", ""(drink flounder pear alsace pennsylvania surrey bosnia surrey)"", ""(drink pork lamb alsace pennsylvania surrey pennsylvania alsace)""]']","Analysis of 5 plans reveals an average of 7.00 steps per plan, with most common actions - feast (15 times), drink (10 times) and most involved objects - rest (25 times), surrey (18 times). The plan with the least number of steps is Plan: 1. The most common action sequence is: overcome abrasion rest pork uranus venus -> feast rest pork okra alsace quebec -> feast rest okra pear quebec guanabara.","['(drink flounder pork pennsylvania surrey bosnia alsace quebec)', '(feast rest flounder rice pennsylvania alsace)', '(drink pork lamb alsace pennsylvania surrey pennsylvania alsace)', '(feast rest lamb flounder surrey pennsylvania)', '(drink pork rice alsace pennsylvania surrey bosnia surrey)', '(feast rest flounder rice surrey pennsylvania)']","Here's a summarized plan based on the provided plans, focusing on key actions and high-importance steps:

Overcoming Abrasion:

Overcome abrasion rest involving pork at uranus and venus.
Feasting:

Feast actions commonly involve combinations of pork, lamb, okra, pear, flounder, and rice across various locations such as alsace, quebec, guanabara, bosnia, surrey, and pennsylvania.
Drinking:

Drink actions involve various combinations of pork, lamb, flounder, pear, okra, and rice, often in combination with locations such as alsace, quebec, pennsylvania, surrey, and bosnia.
Succumbing to Abrasion:

Succumb to abrasion rest involving rice at uranus and venus.
Key Actions:

Overcome Abrasion: The consistent action to overcome abrasion rest involving pork at uranus and venus.
Feast Combinations: Frequent feasting actions with pork, okra, pear, flounder, lamb, and rice across multiple locations.
Drink Combinations: Drinking involving multiple ingredients and locations, indicating a mix of elements in various contexts.
Succumb to Abrasion: Ending actions involve succumbing to abrasion rest involving rice at uranus and venus.
This summary captures the essence of the plans, focusing on the most significant actions and recurring themes."
PDDL,"""mprime""",prob29.pddl.json,"['[""(overcome jealousy excitement pork neptune uranus)"", ""(feast excitement pork broccoli manitoba bavaria)"", ""(feast excitement broccoli shrimp pennsylvania alsace)"", ""(drink pork popover manitoba quebec alsace bavaria oregon)"", ""(succumb jealousy excitement shrimp neptune uranus)"", ""(drink papaya pork quebec alsace pennsylvania quebec manitoba)""]', '[""(overcome jealousy excitement pork neptune uranus)"", ""(drink papaya pork quebec alsace pennsylvania bavaria oregon)"", ""(drink popover papaya bavaria manitoba quebec alsace quebec)"", ""(feast excitement pork broccoli bavaria oregon)"", ""(feast excitement broccoli shrimp pennsylvania alsace)"", ""(succumb jealousy excitement shrimp neptune uranus)""]', '[""(drink scallop papaya oregon bavaria manitoba quebec manitoba)"", ""(overcome jealousy excitement pork neptune uranus)"", ""(feast excitement pork broccoli manitoba bavaria)"", ""(drink broccoli scallop alsace pennsylvania arizona bavaria oregon)"", ""(feast excitement broccoli shrimp arizona pennsylvania)"", ""(succumb jealousy excitement shrimp neptune uranus)""]', '[""(drink shrimp broccoli kentucky oregon bavaria alsace quebec)"", ""(overcome jealousy excitement pork neptune uranus)"", ""(feast excitement pork broccoli manitoba bavaria)"", ""(drink melon shrimp moravia kentucky oregon oregon kentucky)"", ""(feast excitement broccoli shrimp alsace quebec)"", ""(succumb jealousy excitement shrimp neptune uranus)""]', '[""(overcome jealousy excitement pork neptune uranus)"", ""(feast excitement pork broccoli manitoba bavaria)"", ""(drink melon broccoli moravia kentucky oregon alsace quebec)"", ""(feast excitement broccoli shrimp alsace quebec)"", ""(succumb jealousy excitement shrimp neptune uranus)"", ""(drink broccoli pork alsace pennsylvania arizona manitoba bavaria)""]']","Analysis of 5 plans reveals an average of 6.00 steps per plan, with most common actions - feast (10 times), drink (10 times) and most involved objects - excitement (20 times), pork (14 times). The plan with the least number of steps is Plan: 1. The most common action sequence is: overcome jealousy excitement pork neptune uranus -> feast excitement pork broccoli manitoba bavaria -> feast excitement broccoli shrimp pennsylvania alsace.
","['(drink shrimp broccoli kentucky oregon bavaria alsace quebec)', '(drink papaya pork quebec alsace pennsylvania bavaria oregon)', '(drink broccoli pork alsace pennsylvania arizona manitoba bavaria)', '(feast excitement pork broccoli manitoba bavaria)', '(drink pork popover manitoba quebec alsace bavaria oregon)', '(feast excitement broccoli shrimp alsace quebec)']","Here's a summarized plan based on the provided plans, focusing on key actions and high-importance steps:

Overcoming Jealousy and Excitement:

Overcome jealousy and excitement involving pork at neptune and uranus.
Feasting:

Feast actions involve pork, broccoli, and shrimp across various locations such as manitoba, bavaria, pennsylvania, alsace, arizona, and quebec.
Drinking:

Drink actions involve combinations of pork, papaya, popover, scallop, shrimp, broccoli, and melon at various locations including quebec, alsace, pennsylvania, bavaria, oregon, kentucky, moravia, and manitoba.
Succumbing to Jealousy and Excitement:

Succumb to jealousy and excitement involving shrimp at neptune and uranus.
Key Actions:

Overcome Jealousy and Excitement: Consistently overcome jealousy and excitement with pork at neptune and uranus.
Feasting Combinations: Feasting typically involves pork, broccoli, and shrimp across multiple key locations.
Drinking Combinations: Frequent drinking actions with a variety of ingredients and locations, emphasizing diverse contexts and elements.
Succumb to Jealousy and Excitement: Final actions involve succumbing to jealousy and excitement with shrimp at neptune and uranus.
This summary captures the main actions and recurring themes from the plans, providing a concise overview of the critical steps involved."
