Category,Domain,Goal,Plan,PlanSum,TextRank,GPT-4o
Recipes,guacamole,guacamole,"[
    [""""""Ingredients: 3 avocados ripe, ½ small yellow onion finely diced, 2 Roma tomatoes diced, 3 tablespoons finely chopped fresh cilantro, 1 jalapeno pepper seeds removed and finely diced, 2 garlic cloves minced, 1 lime juiced, ½ teaspoon sea salt.
Instructions: 1. Slice the avocados in half, remove the pit, and scoop into a mixing bowl. \n 2. Mash the avocado with a fork and make it as chunky or smooth as you’d like. \n 3. Add the remaining ingredients and stir together. Give it a taste test and add a pinch more salt or lime juice if needed. \n 4. Serve the guacamole with tortilla chips.""""""],
    [""""""Ingredients: 3 avocados ripe, ¼ cup diced red onion, ¼ cup finely chopped fresh cilantro
Zest and juice of 2 limes, 1 small jalapeño pepper diced, ½ teaspoon sea salt plus more to taste, ½ teaspoon ground cumin, 1 to 2 Roma tomatoes seeded and diced.
Instructions: 1. In a large bowl, combine the avocados, onion, cilantro, lime zest and juice, jalapeño, salt, and cumin, if using. Mash until the ingredients are combined but still a bit chunky. \n 2. Fold in the tomatoes, if using. \n 3. Season to taste and serve.""""""],
[""""""Ingredients: 3 ripe avocados, ½ lime juiced (about 1 tablespoon fresh lime juice), ¾ cup grape tomatoes quartered, ⅓ cup diced red or white onion, 1 jalapeno finely diced (or two if you like it really spicy!), ½ cup chopped cilantro, ¼ teaspoon salt plus more to taste, 2 garlic cloves finely minced, Freshly ground black pepper.
Instructions: 1. Mash avocado in a medium bowl, but not so much that it becomes overly creamy. You want a mixture between chunky and creamy consistency. \n 2. Next add in lime juice, grape tomatoes, diced onion, jalapeno, cilantro and salt and pepper. Give it a stir. Taste and adjust seasonings as necessary (add more salt if you like it a little bit saltier!). \n 3. Garnish with extra sliced grape tomatoes, cilantro and jalapenos. Enjoy with your favorite tortilla chips!""""""],
[""""""Ingredients: 15 ounces pitted and halved avocados from 3 medium hass, 1 lime juiced, 1/3 cup red onion minced, 1 small garlic clove mashed or minced, 1 tbsp fresh cilantro chopped, kosher salt and fresh pepper to taste, diced tomato and jalapeño.
Instructions: 1. Make the guacamole: Place the pulp from the avocados in a medium bowl and slightly mash with a fork or a potato masher leaving some large chunks. Add lime juice, salt, pepper, cilantro, red onion, garlic and mix thoroughly. \n 2. If you are serving this at a later time: a great tip to keep the guacamole from turning brown is to cover tightly with plastic wrap so no air gets on it.""""""],
[""""""Ingredients: 3 Haas avocados halved seeded and peeled, 1 lime, ½ teaspoon kosher salt, ½ teaspoon ground cumin, ½ teaspoon cayenne, ½ medium onion diced, ½ jalapeno pepper seeded and minced, 2 roma tomatoes seeded and minced, 1 tablespoon chopped cilantro, 1 clove garlic minced.
Instructions: 1. In a large bowl place the scooped avocado pulp and lime juice, toss to coat. Drain, and reserve the lime juice, after all of the avocados have been coated. Using a potato masher add the salt, cumin, and cayenne and mash. Then, fold in the onions, tomatoes, cilantro, and garlic. Add 1 tablespoon of the reserved lime juice. Let sit at room temperature for 1 hour and then serve.""""""]
]","Analysis of 5 recipes reveals an average of 3.80 steps per recipe, with must-have ingredients - 1 lime juiced (2 times), ½ small yellow onion finely diced (1 times), and key actions - ('slice avocados', 1) (1 times), ('remove pit', 1) (1 times). The recipe with the least number of steps is Recipe: 5.","Must-have Ingredients:
cilantro (3 times)
3 avocados ripe (2 times)
1 lime juiced (2 times)
½ teaspoon ground cumin (2 times)
salt (2 times)

Key Instructions:
1. In a large bowl place the scooped avocado pulp and lime juice, toss to coat. Drain, and reserve the lime juice, after all of the avocados have been coated. Using a potato masher add the salt, cumin, and cayenne and mash. Then, fold in the onions, tomatoes, cilantro, and garlic. Add 1 tablespoon of the reserved lime juice. Let sit at room temperature for 1 hour and then serve.
1. Make the guacamole: Place the pulp from the avocados in a medium bowl and slightly mash with a fork or a potato masher leaving some large chunks. Add lime juice, salt, pepper, cilantro, red onion, garlic and mix thoroughly.
2. Next add in lime juice, grape tomatoes, diced onion, jalapeno, cilantro and salt and pepper. Give it a stir. Taste and adjust seasonings as necessary (add more salt if you like it a little bit saltier!).
1. In a large bowl, combine the avocados, onion, cilantro, lime zest and juice, jalapeño, salt, and cumin, if using. Mash until the ingredients are combined but still a bit chunky.
3. Add the remaining ingredients and stir together. Give it a taste test and add a pinch more salt or lime juice if needed.
4. Serve the guacamole with tortilla chips.","Summary of Guacamole Recipes:
Ingredients:

Avocados: 3 ripe avocados
Onion: ¼ to ½ cup diced (yellow, red, or white)
Tomatoes: Roma or grape, diced or quartered
Cilantro: 1 tablespoon to ½ cup, chopped
Jalapeño Pepper: ½ to 1, seeded and finely diced
Garlic: 1 to 2 cloves, minced
Lime: Juice of 1 to 2 limes
Seasonings: ½ teaspoon salt, optional ground cumin, cayenne pepper, and black pepper
Instructions:

Prepare Avocados: Slice avocados in half, remove the pits, and scoop the flesh into a bowl.
Mash Avocados: Mash the avocados with a fork or potato masher to desired consistency, either chunky or smooth.
Mix Ingredients: Add diced onion, tomatoes, cilantro, jalapeño, garlic, lime juice, and seasonings to the mashed avocados.
Stir and Taste: Mix everything together and adjust seasoning to taste by adding more salt, lime juice, or other spices as needed.
Serve: Serve immediately with tortilla chips. To store, cover tightly with plastic wrap to prevent browning.
This summary captures the essential steps and common ingredients across the provided guacamole recipes while ensuring conciseness and clarity."
Recipes,fried rice,fried rice,"[
    [""""""Ingredients: 3 tablespoons butter, 2 large eggs, whisked, 2 medium carrots peeled and diced, 1 small white onion diced, 1/2 cup frozen peas, 3 cloves garlic minced, salt and black pepper, 4 cups cooked and chilled rice , 3 green onions thinly sliced, 3–4 tablespoons soy sauce or more to taste, 2 teaspoons oyster sauce (optional), 1/2 teaspoons toasted sesame oil.
Instructions: 1. Heat 1/2 tablespoon of butter in a large sauté pan* over medium-high heat until melted. Add egg, and cook until scrambled, stirring occasionally. Remove egg, and transfer to a separate plate. \n 2. Add an additional 1 tablespoon butter to the pan and heat until melted. Add carrots, onion, peas and garlic, and season with a generous pinch of salt and pepper. Sauté for about 5 minutes or until the onion and carrots are soft. Increase heat to high, add in the remaining 1 1/2 tablespoons of butter, and stir until melted. Immediately add the rice, green onions, soy sauce and oyster sauce (if using), and stir until combined. Continue sautéing for an additional 3 minutes to fry the rice, stirring occasionally.  (I like to let the rice rest for a bit between stirs so that it can crisp up on the bottom.)  Then add in the eggs and stir to combine. Remove from heat, and stir in the sesame oil until combined.  Taste and season with extra soy sauce, if needed. \n 3. Serve immediately, or refrigerate in a sealed container for up to 3 days.""""""],
    [""""""Ingredients: 2 tablespoons butter divided, 3 eggs whisked, 2 medium carrots small dice, 1 small onion small dice, 3 cloves garlic minced, 1 cup frozen peas thawed, 4 cups cooked and chilled rice, 3 tablespoons low sodium soy sauce, 2 tablespoons oyster sauce, 1 teaspoon sesame oil, sliced green onions for garnish if desired.
Instructions: 1. Heat 1 tablespoon of butter into a large skillet. Add the eggs and scramble until fully cooked. Remove them from the pan and set aside. \n 2. Add the remaining tablespoon of butter into the pan. Add carrots and onion to the pan and cook until tender, 3-4 minutes. Stir in garlic and cook for an additional minute. \n 3. Add in the cold rice and peas and sauté for 3-4 minutes. The rice should brown up a bit. \n 4. Add the eggs back to the pan and stir in soy sauce, oyster sauce and sesame oil. Cook for 1-2 minutes to heat through. Serve immediately with green onions for garnish, if desired. """"""],
[""""""Ingredients: 1 1/2 c. long-grain rice (preferably jasmine) or about 2 1/2 c. leftover rice, 3 Tbsp. peanut or vegetable oil divided, 3 large eggs beaten to blend, 5 cloves garlic grated or finely chopped, 1 (1"") piece ginger finely chopped, 4 scallions thinly sliced, 2 Tbsp. reduced-sodium soy sauce, 1 tsp. granulated sugar, 1 tsp. kosher salt, 1/2 tsp. white pepper, 1/4 tsp. MSG, 1/3 c. frozen peas, 1 Tbsp. unsalted butter cut into pieces
Instructions: 1. Fill a large pot about halfway with water and bring to a boil. Meanwhile, thoroughly rinse rice in a strainer until water runs almost clear. \n 2. Cook rice in boiling water 3 minutes, then drain with a fine-mesh strainer that fits in pot. Wipe out pot, pour in about 2"" water, and bring to a simmer. With rice in strainer, make a few divots in rice through to bottom of strainer with a chopstick or butter knife. \n 3. Cover strainer with foil, then place in pot over simmering water. Place pot lid over strainer; if there’s a lot of steam escaping, wrap foil or a damp tea towel around rim of pot and strainer. (This can also be done in a bamboo steamer or a standard steaming setup that won’t let the rice fall through.) \n 4. Steam until rice is cooked through but still slightly al dente, about 15 minutes; it should have a drier feel than normal steamed rice. Spread onto a baking sheet and let cool to room temperature. Refrigerate until ready to use. \n 5. Heat a large wok or well-seasoned cast-iron skillet over high heat. Pour in 1 tablespoon oil and swirl wok to coat. Once oil is shimmering, add eggs and cook, breaking up into small pieces, until cooked through but not browning, about 1 minute. Transfer to a plate. Wipe out wok. \n 6. In same wok over high heat, swirl remaining 2 tablespoons oil. Cook garlic and ginger, tossing constantly, until fragrant and garlic begins to brown, about 30 seconds. Add white and pale green scallion parts and cook, tossing constantly, until softened, about 1 minute. Add rice and immediately toss to combine. Fry rice, stirring constantly, until no clumps remain and you begin to hear some light popping sounds from the rice toasting, 2 to 3 minutes. \n 7. Add soy sauce, granulated sugar, salt, pepper, and MSG and cook, tossing constantly, until soy sauce is absorbed, about 1 minute. Add eggs, peas, and dark green scallion parts and cook, tossing constantly, until warmed through and incorporated, about 2 minutes more. Add butter and cook, tossing, until melted, about 30 seconds more.""""""],
[""""""Ingredients: 2 cups cooked white rice, 2 tbs butter, 1/2 c chopped carrots, 1/2 c chopped onions, 1/2 c frozen peas, 2 tbs minced garlic, 1 tsp garlic powder, 2 eggs beaten, vegetable oil (as needed), 4 tbs soy sauce, 1 tsp sesame oil.
Instructions: 1. First, in a large skillet, melt the butter and sauté the carrots for 5 minutes. Add he onions and lightly season them with salt and pepper. Once the vegetables are soft, add the minced garlic and stir for 1 minute. \n 2. Now add about 1 tbs of oil to the skillet and whisk the beaten eggs into the vegetables just until they’re cooked. Try your best not to over cook the eggs. \n 3. After that, add the white rice into the skillet and drizzle it with a little more oil (about 1 tbs). Add the peas and stir everything together. Cook the rice in the skillet for about 2-4 minutes stirring frequently. \n 4. Next add the soy sauce, sesame oil, salt, pepper and garlic powder. Please keep in mind that the soy sauce is salty. \n 5. Finally, stir the sauces into the rice mixture and let that cook for a couple more minutes. Then plate the rice, let it cool slightly and enjoy!""""""],
[""""""Ingredients: 2 tbsp oil, ½ onion chopped, 2 garlic cloves, 120g bacon, 1-1.5 cups diced vegetables, 2 cups, 3 eggs, ¾ cup green onions, 1 tbsp chinese cooking wine, 1 tbsp oyster sauce, 1 tbsp light soy sauce, 1 tsp sesame oil, ¼ tsp white pepper.
Instructions: 1. Heat oil – Heat about 1 1/2 tbsp oil in a wok or 2 tbsp oil in a skillet over high heat until smoking. \n 2. Add onion, garlic and bacon. Cook until bacon is light golden – about 1 1/2 minutes. \n 3. Add vegetables (still frozen is fine). Cook for 2 minutes so they defrost and water evaporates. \n 4. Add rice and Sauce ingredients. Cook for 1 1/2 minutes until liquid evaporates. \n 5. Add rice and Sauce ingredients. Cook for 1 1/2 minutes until liquid evaporates. \n 6. Serve – Add green onion then stir the egg into the rice. Remove from heat and serve immediately!""""""]
]","Analysis of 5 recipes reveals an average of 6.00 steps per recipe, with must-have ingredients - 3 cloves garlic minced (2 times), 2 large eggs (1 times), and key actions - ('remove egg', 1) (1 times), ('transfer to', 1) (1 times). The recipe with the least number of steps is Recipe: 1.
","Must-have Ingredients:
tossing constantly (4 times)
3 cloves garlic minced (2 times)
salt (2 times)
3 tablespoons butter (1 times)
2 large eggs (1 times)

Key Instructions:
2. Add an additional 1 tablespoon butter to the pan and heat until melted. Add carrots, onion, peas and garlic, and season with a generous pinch of salt and pepper. Sauté for about 5 minutes or until the onion and carrots are soft. Increase heat to high, add in the remaining 1 1/2 tablespoons of butter, and stir until melted. Immediately add the rice, green onions, soy sauce and oyster sauce (if using), and stir until combined. Continue sautéing for an additional 3 minutes to fry the rice, stirring occasionally.  (I like to let the rice rest for a bit between stirs so that it can crisp up on the bottom.)  Then add in the eggs and stir to combine. Remove from heat, and stir in the sesame oil until combined.  Taste and season with extra soy sauce, if needed.
2. Add the remaining tablespoon of butter into the pan. Add carrots and onion to the pan and cook until tender, 3-4 minutes. Stir in garlic and cook for an additional minute.
4. Add the eggs back to the pan and stir in soy sauce, oyster sauce and sesame oil. Cook for 1-2 minutes to heat through. Serve immediately with green onions for garnish, if desired.
3. After that, add the white rice into the skillet and drizzle it with a little more oil (about 1 tbs). Add the peas and stir everything together. Cook the rice in the skillet for about 2-4 minutes stirring frequently.
1. First, in a large skillet, melt the butter and sauté the carrots for 5 minutes. Add he onions and lightly season them with salt and pepper. Once the vegetables are soft, add the minced garlic and stir for 1 minute.
4. Add rice and Sauce ingredients. Cook for 1 1/2 minutes until liquid evaporates.","Summary of Fried Rice Recipes:
Ingredients:

Base:
Cooked and chilled rice: 2 to 4 cups (preferably jasmine or white rice)
Eggs: 2 to 3, whisked and scrambled
Vegetables:
Carrots, peas, onions (white, yellow, or green), garlic, and optional additional vegetables (bell pepper, leek, etc.)
Seasonings and Sauces:
Soy sauce: 3 to 4 tablespoons
Oyster sauce: 1 to 2 tablespoons (optional)
Sesame oil: ½ to 1 teaspoon
Salt, pepper, garlic powder, and optional MSG
Oils and Fats:
Butter: 2 to 3 tablespoons
Vegetable, peanut, or olive oil: 2 to 3 tablespoons
Optional Add-ins:
Bacon, Chinese cooking wine, oyster sauce, sugar, and white pepper
Instructions:

Scramble Eggs: Heat ½ tablespoon of butter or oil in a large sauté pan or wok over medium-high heat. Add whisked eggs and cook until scrambled. Remove eggs from the pan and set aside.
Cook Vegetables: Add more butter or oil to the pan. Sauté diced carrots, onions, peas, and garlic until the vegetables are tender.
Add Rice: Increase heat to high and add the remaining butter or oil. Stir in the cooked and chilled rice, breaking up any clumps. Cook for a few minutes until the rice is heated through and slightly crispy.
Season and Combine: Add soy sauce, oyster sauce (if using), sesame oil, and other seasonings. Stir to combine and continue to cook for a few minutes, allowing the rice to absorb the flavors.
Mix in Eggs and Serve: Add the scrambled eggs back into the pan and stir to combine. Garnish with sliced green onions and serve immediately.
This summary captures the essential steps and common ingredients across the provided fried rice recipes while ensuring conciseness and clarity."
Recipes,pancakes,pancakes,"[
    [""""""Ingredients: 1 ½ cups all-purpose flour, 3 ½ teaspoons baking powder, 1 tablespoon white sugar, ¼ teaspoon salt, or more to taste, 1 ¼ cups milk, 3 tablespoons butter, melted, 1 egg.
Instructions: 1. Sift flour, baking powder, sugar, and salt together in a large bowl. Make a well in the center and add milk, melted butter, and egg; mix until smooth. \n 2. Heat a lightly oiled griddle or pan over medium-high heat. Pour or scoop the batter onto the griddle, using approximately 1/4 cup for each pancake; cook until bubbles form and the edges are dry, about 2 to 3 minutes. Flip and cook until browned on the other side. Repeat with remaining batter.""""""],
    [""""""Ingredients: 2 cups all purpose flour, ¼ cup granulated sugar, 4 teaspoons baking powder, ¼ teaspoon baking soda, ½ teaspoon salt, 1 ¾ cups milk, ¼ cup butter, 2 teaspoons pure vanilla extract, 1 large egg.
Instructions: 1. Combine together the flour, sugar (or sweetener), baking powder, baking soda and salt in a large-sized bowl. Make a well in the centre and add the milk, slightly cooled melted butter, vanilla and egg. \n 2. Use a wire whisk to whisk the wet ingredients together first before slowly folding them into the dry ingredients. Mix together until smooth (there may be a couple of lumps but that's okay). \n 3. Set the batter aside and allow to rest while heating up your pan or griddle. \n 4. Heat a nonstick pan or griddle over low-medium heat and wipe over with a little butter to lightly grease pan. Pour ¼ cup of batter onto the pan and spread out gently into a round shape with the back of your ladle or measuring cup. \n 5. When the underside is golden and bubbles begin to appear on the surface, flip with a spatula and cook until golden. Repeat with remaining batter. \n 6. Serve with honey, maple syrup, fruit, ice cream or frozen yoghurt, or enjoy plain!""""""],
[""""""Ingredients: 2 cups all purpose flour, 4 teaspoons baking powder, ¼ cup sugar, 1 teaspoon salt, 2 large eggs, 1.5 cups milk, 4 tablespoons unsalted butter, vegetable oil.
Instructions: 1. In a large bowl, whisk together the flour, baking powder, sugar and salt. \n 2. In a medium bowl, whisk the eggs and milk until evenly combined. \n 3. Pour the milk/egg mixture and the melted butter into the dry ingredients and whisk until just combined. If the batter seems too thick, add 1 to 2 tablespoons more milk. \n 4. Heat a griddle or nonstick pan over medium heat; coat it lightly with vegetable oil and swirl in a thin pat of butter. Ladle or drop the batter onto the griddle, using approximately ¼ cup for each pancake; cook until the first side is golden brown, or until the top surface bubbles and is dotted with holes. Flip and cook until the other side is golden brown. This happens quickly so peek after 30 seconds and watch carefully! Adjust the heat setting if necessary. Wipe the griddle clean with a paper towel between batches. Serve immediately with maple syrup.""""""],
[""""""Ingredients: 2 cups flour, 3 tablespoons sugar, ½ teaspoon salt, 1 tablespoon baking powder, 2 eggs, ¼ cup butter, 1 ¾ cups milk.
Instructions: 1. Mix the dry items first. \n 2. Combine the eggs and melted butter to the milk and slowly stir into the flour mixture. \n 3. Heat the griddle to325 F or the pan to medium high let sit at least 10 minutes while heating the griddle orpan. \n 4. These will be high, but light and fluffy.""""""],
[""""""Ingredients: flour, sugar, baking powder, milk, egg, butter, vanilla extract.
Instructions: 1. Melt the butter and set it aside. In a medium bowl, whisk together the flour, sugar, baking powder, and salt. \n 2. In a separate bowl, whisk together milk, egg, melted butter, and vanilla extract. (Don’t worry if the butter solidifies slightly). \n 3. Create a well in the center of your dry ingredients. Pour in the milk mixture and stir gently with a fork until the flour is just incorporated. A few small lumps are okay. As the batter sits, it should start to bubble. \n 4. Place a large skillet or griddle over medium heat. Sprinkle in a few drops of water to test if it’s ready. You want them to dance around a bit and evaporate. \n 5. Brush the skillet with melted butter (this creates crispy edges, but you can skip it if using a quality nonstick pan). \n 6. Scoop the batter onto the skillet using a 1/4 cup measure or large cookie scoop, and spread each pancake into a 4-inch circle. \n 7. After 1 to 2 minutes, the edges will look dry, and bubbles will form and pop on the surface. Flip the pancakes and cook for another 1 to 2 minutes until lightly browned and cooked in the middle. \n 8. Serve immediately with warm syrup, butter, and berries.""""""]
]","Analysis of 5 recipes reveals an average of 5.80 steps per recipe, with must-have ingredients - 4 teaspoons baking powder (2 times), ½ teaspoon salt (2 times), and key actions - ('bake powder', 4) (1 times), ('salt in', 1) (1 times). The recipe with the least number of steps is Recipe: 1.","Must-have Ingredients:
baking powder (5 times)
sugar (3 times)
melted butter (2 times)
2 cups all purpose flour (2 times)
4 teaspoons baking powder (2 times)

Key Instructions:
2. Heat a lightly oiled griddle or pan over medium-high heat. Pour or scoop the batter onto the griddle, using approximately 1/4 cup for each pancake; cook until bubbles form and the edges are dry, about 2 to 3 minutes. Flip and cook until browned on the other side. Repeat with remaining batter.
4. Heat a griddle or nonstick pan over medium heat; coat it lightly with vegetable oil and swirl in a thin pat of butter. Ladle or drop the batter onto the griddle, using approximately ¼ cup for each pancake; cook until the first side is golden brown, or until the top surface bubbles and is dotted with holes. Flip and cook until the other side is golden brown. This happens quickly so peek after 30 seconds and watch carefully! Adjust the heat setting if necessary. Wipe the griddle clean with a paper towel between batches. Serve immediately with maple syrup.
1. Sift flour, baking powder, sugar, and salt together in a large bowl. Make a well in the center and add milk, melted butter, and egg; mix until smooth.
1. Combine together the flour, sugar (or sweetener), baking powder, baking soda and salt in a large-sized bowl. Make a well in the centre and add the milk, slightly cooled melted butter, vanilla and egg.
4. Heat a nonstick pan or griddle over low-medium heat and wipe over with a little butter to lightly grease pan. Pour ¼ cup of batter onto the pan and spread out gently into a round shape with the back of your ladle or measuring cup.
1. Melt the butter and set it aside. In a medium bowl, whisk together the flour, sugar, baking powder, and salt.","Summary of Pancake Recipes:
Ingredients:

Dry Ingredients:

All-purpose flour: 1 ½ to 2 cups
Baking powder: 3 ½ to 4 teaspoons
Sugar: 1 to 4 tablespoons
Salt: ¼ to 1 teaspoon
Wet Ingredients:

Milk: 1 ¼ to 1 ¾ cups
Eggs: 1 to 2
Butter: 3 to 4 tablespoons, melted
Optional: Vanilla extract: 1 to 2 teaspoons
Instructions:

Mix Dry Ingredients: In a large bowl, sift or whisk together flour, baking powder, sugar, and salt.
Mix Wet Ingredients: In a separate bowl, whisk together milk, melted butter, eggs, and vanilla extract if using.
Combine Mixtures: Make a well in the center of the dry ingredients and pour in the wet ingredients. Mix until just combined; a few lumps are okay.
Heat Griddle: Preheat a griddle or nonstick pan over medium-high heat and lightly grease with butter or oil.
Cook Pancakes: Pour approximately ¼ cup of batter onto the griddle for each pancake. Cook until bubbles form on the surface and edges look dry, about 2-3 minutes. Flip and cook until the other side is golden brown, about 1-2 minutes.
Serve: Serve pancakes immediately with desired toppings such as syrup, butter, fruit, or yogurt.
This summary captures the essential steps and common ingredients across the provided pancake recipes while ensuring conciseness and clarity."
