Category,Domain,Goal,Plan,PlanSum,TextRank,GPT-4o
Recipes,pasta,pasta,"[
    [""""""Ingredients: 2 tablespoons olive oil, 1 pound boneless, skinless chicken thighs (about 4) cut into 1-inch pieces, 2 1/2 teaspoons Cajun seasoning, 2 medium green bell peppers, stemmed, seeded and cut into 1/4-inch strips, 1 small yellow onion thinly sliced, 2 cloves garlic chopped, 12 ounces smooth penne , 4 cups low-sodium chicken broth, One 14.5-ounce can diced tomatoes, 6 ounces cream cheese cubed and at room temperature, Kosher salt, 4 scallions sliced for serving.
Instructions: 1. Heat the oil in large wide pot over medium-high heat. Add the chicken and Cajun seasoning and cook, stirring occasionally, until the chicken just starts to change color and the spices are toasted, about 2 minutes. \n 2. Add the peppers and onions and cook until they just begin to release some of their juices, 3 to 4 minutes. Stir in the garlic and cook until softened, 1 minute. \n 3. Add the pasta, chicken broth and tomatoes and bring to a boil over medium-high heat. When it boils, continue to cook, stirring occasionally, until the pasta is al dente and the sauce is thickened and reduced by about half, about 15 minutes. \n 4. Remove from the heat and add the cream cheese and 1 1/2 teaspoons kosher salt. Stir until the cream cheese is combined and melted. Don't worry if the sauce looks runny, it will thicken as it sits. Top with sliced scallions.""""""],
    [""""""Ingredients: Kosher salt and freshly ground black pepper, 3 tablespoons extra-virgin olive oil, 4 cloves garlic thinly sliced, 1/2 teaspoon crushed red pepper flakes, Two 28-ounce cans plum tomatoes, crushed by hand, 1 cup chopped fresh basil, plus 4 large fresh basil sprigs, 1 pound dried rigatoni, 1 pound spicy Italian sausage, casings removed, 1 1/2 cups shredded mozzarella, 1 1/2 cups shredded provolone, 1 cup grated Parmesan.
Instructions: 1. Preheat the oven to 450 degrees F. \n 2. Bring a large pot of salted water to a boil. Heat 2 tablespoons of the oil in a medium saucepan over medium heat. Add the garlic and red pepper flakes and cook, stirring, until the garlic is golden, about 2 minutes. Add both cans of the tomatoes and 1 cup water. Increase the heat to medium-high and bring to a simmer. Reduce the heat slightly, add the basil sprigs and simmer rapidly, uncovered, until thickened, 15 to 20 minutes. Discard basil and stir in the chopped basil. Season with salt and pepper. \n 3. While the sauce simmers, heat the remaining 1 tablespoon oil in a large skillet over medium-high heat. Add the sausage and cook, breaking up any clumps with a wooden spoon, until brown, about 5 minutes. Transfer the sausage to a large bowl with a slotted spoon. \n 4. Cook the rigatoni in the salted boiling water until very al dente, about 2 minutes less than the package directions instruct. Drain the pasta and add it to the large bowl. \n 5. Add the tomato sauce and half each of the mozzarella, provolone and Parmesan cheeses to the bowl and stir well to combine. Transfer the pasta-sausage mixture to a 3- to 4-quart baking dish and top with the remaining mozzarella, provolone and Parmesan cheeses. Bake, uncovered, until browned, about 15 minutes. Let the pasta rest about 10 minutes before serving.""""""],
[""""""Ingredients: 2 pints (20 ounces) cherry tomatoes, 1/2 cup extra-virgin olive oil, Kosher salt and freshly ground black pepper, One 8-ounce block feta cheese drained, 10 ounces mezze rigatoni, 1 clove garlic finely grated, Pinch crushed red pepper flakes, 1/4 cup fresh basil leaves thinly sliced, Flaky sea salt for serving
Instructions: 1. Preheat the oven to 400 degrees F. \n 2. Toss the cherry tomatoes and olive oil with 1/4 teaspoon of salt and several grinds of black pepper in a medium bowl until combined. Transfer to a 2 1/2- to 3-quart baking dish, place the feta in the center of the tomatoes and season with a pinch of black pepper. Bake until the tomatoes have burst and the feta has softened, about 30 minutes. Raise the heat to 450 degrees F and continue to cook until the tomatoes and feta are golden brown, 10 to 15 minutes more. \n 3.Meanwhile, bring a large pot of generously salted water to a boil over high heat. Add the pasta and cook until al dente, about 13 minutes. Reserve 1/2 cup of the cooking water, then thoroughly drain the pasta.  \n 4. As soon as the tomatoes and feta come out of the oven, stir in the garlic and red pepper flakes (if using). Use the back of a spoon to smash the tomatoes and feta into a smooth and creamy sauce (it’s okay if some of the oil isn’t fully integrated). Add the pasta and half the basil and toss until evenly coated. If the sauce is too thick, stir in some pasta water a couple tablespoons at a time. Taste and adjust the seasoning with salt and pepper. Serve topped with the remaining basil and a pinch of sea salt. """"""],
[""""""Ingredients: Kosher salt and freshly ground black pepper, 12 ounces fettuccine, Olive oil for tossing, 12 ounces boneless skinless chicken breast (about 2), 1 stick (8 tablespoons) unsalted butter, 2 cups heavy cream, 2 pinches freshly grated nutmeg, 1 1/2 cups freshly grated Parmigiano-Reggiano
Instructions: 1. Bring a large pot of water to a boil, and salt generously. Add the pasta and cook according to package directions until al dente (tender but still slightly firm). Drain and toss with a splash of oil. \n 2. Meanwhile, slice the chicken into 1/4-inch-thick strips, and lay them on a plate or a sheet of waxed paper. Season with salt and pepper. \n 3. Heat a large skillet over medium heat. Add 2 tablespoons of the butter. When the butter melts, raise the heat to medium-high and add the chicken in 1 layer. Cook, without moving the pieces, until the underside has browned, 1 to 2 minutes. Flip the pieces, and cook until browned and cooked through, 2 to 3 minutes more. Transfer the chicken to a medium bowl. \n 4. Reduce the heat to medium. Add the remaining 6 tablespoons butter. Scrape the bottom of the skillet with a wooden spoon to release any browned bits. When the butter has mostly melted, whisk in the cream and nutmeg and bring to a simmer, then cook for 2 minutes. Lower the heat to keep the sauce just warm. \n 5. Whisk the Parmigiano-Reggiano into the sauce. Add the chicken and cooked pasta and toss well. Season with salt and pepper. Serve hot in heated bowls.""""""],
[""""""Ingredients: 1 tablespoon olive oil, 1 pound sweet Italian sausage removed from casing, 1 medium onion diced, 2 teaspoons dried oregano, 1/2 teaspoon fennel seeds, Pinch red pepper flakes, 2 cloves garlic minced, Kosher salt and freshly ground black pepper, 4 cups low-sodium chicken broth, One 28-ounce can tomato puree, 2 tablespoons tomato paste, 1 pound fusilli pasta (or other pasta shape), 1 cup shredded mozzarella, 1/4 cup mascarpone, Shaved Parmesan for serving, 10 to 12 fresh basil leaves for serving.
Instructions: 1. Heat the olive oil in a large, deep skillet over medium heat. When the oil is hot, add the sausage and cook until it starts to brown, about 5 minutes. Add the onions and cook until softened and translucent and the sausage is well browned, another 5 to 7 minutes. Add the oregano, fennel seeds, red pepper flakes, garlic and some salt and black pepper and stir again. \n 2. Next, add the broth, tomato puree and tomato paste and stir well. Add the uncooked pasta into the sauce, bring to a simmer and cook, stirring occasionally, until the pasta is al dente, 15 to 20 minutes. \n 3. Remove from the heat and stir in the mozzarella and mascarpone. Taste and add more seasoning if necessary. Serve with shaved Parmesan and torn basil leaves.""""""]
]","Analysis of 5 recipes reveals an average of 5.20 steps per recipe, with must-have ingredients - 4 cups low-sodium chicken broth (2 times), Kosher salt and freshly ground black pepper (2 times), and key actions - ('heat oil in over', 1) (1 times), ('change color', 1) (1 times). The recipe with the least number of steps is Recipe: 5.
","Must-have Ingredients:
stirring occasionally (3 times)
4 cups low-sodium chicken broth (2 times)
Kosher salt and freshly ground black pepper (2 times)
uncovered (2 times)
Kosher salt and freshly ground black pepper (2 times)

Key Instructions:
2. Bring a large pot of salted water to a boil. Heat 2 tablespoons of the oil in a medium saucepan over medium heat. Add the garlic and red pepper flakes and cook, stirring, until the garlic is golden, about 2 minutes. Add both cans of the tomatoes and 1 cup water. Increase the heat to medium-high and bring to a simmer. Reduce the heat slightly, add the basil sprigs and simmer rapidly, uncovered, until thickened, 15 to 20 minutes. Discard basil and stir in the chopped basil. Season with salt and pepper.
1. Heat the olive oil in a large, deep skillet over medium heat. When the oil is hot, add the sausage and cook until it starts to brown, about 5 minutes. Add the onions and cook until softened and translucent and the sausage is well browned, another 5 to 7 minutes. Add the oregano, fennel seeds, red pepper flakes, garlic and some salt and black pepper and stir again.
4. As soon as the tomatoes and feta come out of the oven, stir in the garlic and red pepper flakes (if using). Use the back of a spoon to smash the tomatoes and feta into a smooth and creamy sauce (it’s okay if some of the oil isn’t fully integrated). Add the pasta and half the basil and toss until evenly coated. If the sauce is too thick, stir in some pasta water a couple tablespoons at a time. Taste and adjust the seasoning with salt and pepper. Serve topped with the remaining basil and a pinch of sea salt.
3. Add the pasta, chicken broth and tomatoes and bring to a boil over medium-high heat. When it boils, continue to cook, stirring occasionally, until the pasta is al dente and the sauce is thickened and reduced by about half, about 15 minutes.
3. Heat a large skillet over medium heat. Add 2 tablespoons of the butter. When the butter melts, raise the heat to medium-high and add the chicken in 1 layer. Cook, without moving the pieces, until the underside has browned, 1 to 2 minutes. Flip the pieces, and cook until browned and cooked through, 2 to 3 minutes more. Transfer the chicken to a medium bowl.
4. Reduce the heat to medium. Add the remaining 6 tablespoons butter. Scrape the bottom of the skillet with a wooden spoon to release any browned bits. When the butter has mostly melted, whisk in the cream and nutmeg and bring to a simmer, then cook for 2 minutes. Lower the heat to keep the sauce just warm.","Summary of Pasta Recipes:
Ingredients:

Protein: Chicken thighs or breasts, Italian sausage (sweet or spicy)
Vegetables: Bell peppers, onions, garlic, cherry tomatoes
Pasta: Penne, rigatoni, fettuccine, mezze rigatoni, fusilli
Dairy: Cream cheese, mozzarella, provolone, Parmesan, feta, heavy cream, mascarpone
Seasonings: Cajun seasoning, red pepper flakes, basil, thyme, oregano, fennel seeds, nutmeg
Others: Chicken broth, canned tomatoes, tomato paste, olive oil, butter, fresh herbs, salt, and pepper
Instructions:

Prepare Ingredients: Dice vegetables, slice protein, shred cheese, and measure out seasonings.
Cook Protein: Heat oil or butter in a large skillet over medium heat. Add seasoned chicken or sausage and cook until browned.
Add Vegetables and Seasonings: Cook vegetables (onions, bell peppers, garlic) until softened. Add seasonings (Cajun, oregano, red pepper flakes, etc.).
Add Liquid Ingredients: Pour in broth, tomato puree, or diced tomatoes. Bring to a boil.
Cook Pasta: Add uncooked pasta to the skillet, ensuring it's submerged in liquid. Cook until pasta is al dente, stirring occasionally.
Combine and Serve: Mix in dairy (cream cheese, mascarpone, or heavy cream) and additional cheese (mozzarella, Parmesan). Stir until well combined and melted. Adjust seasoning to taste.
Bake or Simmer (optional): Some recipes may require baking or additional simmering to meld flavors and thicken the sauce.
Garnish: Top with fresh herbs (basil, thyme) and additional cheese before serving.
This summary captures the essential steps and common ingredients across the provided pasta recipes while ensuring conciseness and clarity."
Recipes,chicken curry,chicken curry,"[
    [""""""Ingredients: 3 tablespoons olive oil, 1 small onion chopped, 2 cloves garlic minced, 3 tablespoons curry powder, 1 teaspoon ground cinnamon, 1 teaspoon paprika, 1 bay leaf, ½ teaspoon grated fresh ginger root, ½ teaspoon white sugar, salt to taste, 2 skinless, boneless chicken breast halves - cut into bite-size pieces, 1 tablespoon tomato paste, 1 cup plain yogurt, ¾ cup coconut milk, ½ lemon, juiced, ½ teaspoon cayenne pepper.
Instructions: 1. Heat olive oil in a skillet over medium heat. Sauté onion until lightly browned. \n 2. Stir in garlic, curry powder, cinnamon, paprika, bay leaf, ginger, sugar, and salt. Continue stirring for 2 minutes. \n 3. Add chicken pieces, tomato paste, yogurt, and coconut milk. Bring to a boil, reduce heat, and simmer for 20 to 25 minutes. \n 4. Remove bay leaf, and stir in lemon juice and cayenne pepper. Simmer 5 more minutes. \n 5. Serve hot and enjoy!""""""],
    [""""""Ingredients: Coriander, cumin, turmeric, fennel seeds, cinnamon, pepper, ground mustard, ground cloves, cayenne pepper, salt, Olive oil, onion, garlic, ginger, Low-sodium chicken broth, Canned tomatoes, Chicken breasts, Cornstarch, Heavy cream, Chopped cilantro. 
Instructions: 1. Mix spices together \n 2. Saute onion, garlic and ginger in a skillet. \n 3. Add broth and tomatoes, simmer. \n 4. Blend mixture in a blender as directed then return to skillet. \n 4. Season sauce then add chicken. \n 5. Simmer chicken in sauce until cooked through. \n 6. Add cornstarch slurry during last minute to thicken sauce. \n 7. Stir in cream. \n . Serve over rice garnished with cilantro.""""""],
[""""""Ingredients: 2 tablespoons canola, corn or other neutral oil, 2 large onions peeled and sliced, Salt and freshly ground black pepper to taste, 2 teaspoons curry powder, 1 can unsweetened coconut milk (1½ to 2 cups), 1½pounds peeled shrimp or boneless chicken cut into ¾- to 1-inch chunks, 1 cup peeled seeded and diced tomato, Chopped basil or mint for garnish (optional)
Instructions: 1. Place oil in a large skillet; turn heat to medium-high. A minute later, add onions, along with a generous pinch of salt and some pepper. Cook, stirring occasionally, until onions are very soft and almost falling apart, 15 minutes or more. Stir in curry powder, and cook, stirring, for another minute or so. \n 2. Add coconut milk, and cook until it thickens, about 2 minutes, stirring occasionally. Add chicken, and stir, then cook until done, 3 to 6 minutes. (If you use shrimp, keep in mind that it cooks a little faster than chicken; if you are in doubt about whether chicken is done, cut into a piece.) \n 3. Add tomato, and cook another minute; adjust seasonings as necessary. Serve over rice, garnished with basil or mint, if desired.""""""],
[""""""Ingredients: 1 1/2 pounds boneless skinless chicken breasts or thighs or a mix!, 1/2 teaspoon kosher salt, 1/2 teaspoon ground black pepper, 2 tablespoons coconut oil, 1 red bell pepper thinly sliced, 1 leek thinly sliced, 2 cloves garlic minced, 1/2 teaspoon grated fresh ginger, 2 tablespoons red curry paste, 1 can full-fat coconut milk (14 ounces) (do not use light, or the sauce won't thicken properly), 3 tablespoons fresh cilantro torn, Prepared brown rice for serving
Instructions: 1. Place a rack in the center of your oven and preheat the oven to 375°F. Season the chicken with salt and black pepper. \n 2. Melt the coconut oil over medium-high heat in a large, ovenproof skillet. Add the chicken and sear on both sides until deeply golden brown. Transfer to a plate. \n 3. Reduce the heat to medium-low. Add the bell pepper, leek, garlic, and ginger, and stir to combine. Cook for 2 minutes, until slightly softened. \n 4. Stir in the curry paste. Cook for 5 additional minutes, stirring often. Slowly pour in the coconut milk while stirring to combine. Return the reserved chicken to the skillet. \n 5. Place the skillet in the oven and bake for 25 minutes. The chicken will be fully cooked when a thermometer inserted in the thickest part of the chicken registers 165°F, and the juices run clear. (Note: Smaller chicken breasts may be done closer to the 15-minute mark.) \n 6. Top with cilantro. Serve with rice, spooning lots of the yummy curry coconut milk sauce over the top.""""""],
[""""""Ingredients: 1¼ pounds boneless, skinless chicken breasts cut into ¼-inch strips, Salt and freshly ground black pepper, 2½ teaspoons curry powder, 3 tablespoons vegetable oil, 1 medium yellow onion finely chopped, 4 garlic cloves minced, 1 tablespoon grated fresh ginger , 2 cups low-sodium chicken broth, 1 tablespoon cornstarch, 2 teaspoons sugar, 1 cup frozen peas (no need to thaw), ¼ cup plain low fat (2%) or whole Greek yogurt (do not use nonfat), ¼ cup chopped fresh cilantro.
Instructions: 1. Sprinkle the chicken evenly with ¾ teaspoon salt, ¼ teaspoon pepper and 1 teaspoon curry powder. \n 2. Heat 1½ tablespoons of oil in a 12-inch skillet over high heat until just smoking. Add the chicken in a single layer and cook, stirring occasionally, until lightly browned but still pink in spots, about 3 minutes. Transfer the partially cooked chicken to a clean bowl and set aside. \n 3. Add the remaining 1½ tablespoons oil to the skillet and set heat to medium. Add the onions and cook, stirring occasionally, until softened, about 5 minutes. Stir in the garlic, ginger and remaining 1½ teaspoons curry powder and cook until fragrant, about a minute more. \n 4. Whisk the chicken broth and cornstarch together to dissolve the cornstarch, then add to the skillet along with the sugar and ⅛ teaspoon salt. Bring to a boil, then reduce the heat to medium and cook until the sauce is nicely thickened, about 5 minutes. \n 5. Add the peas and partially cooked chicken to the skillet, turn the heat down to low and simmer until the chicken is cooked through, a few minutes. Off the heat, stir in the yogurt and cilantro; then season with salt and pepper, to taste. Serve with basmati rice.""""""]
]","Analysis of 5 recipes reveals an average of 6.60 steps per recipe, with must-have ingredients - 2 cloves garlic minced (2 times), 1 small onion chopped (1 times), and key actions - ('turn heat', 1) (1 times), ('stir in', 1) (1 times). The recipe with the least number of steps is Recipe: 3.","Must-have Ingredients:
stirring occasionally (3 times)
2 cloves garlic minced (2 times)
cinnamon (2 times)
ginger (2 times)
garlic (2 times)

Key Instructions:
5. Add the peas and partially cooked chicken to the skillet, turn the heat down to low and simmer until the chicken is cooked through, a few minutes. Off the heat, stir in the yogurt and cilantro; then season with salt and pepper, to taste. Serve with basmati rice.
4. Whisk the chicken broth and cornstarch together to dissolve the cornstarch, then add to the skillet along with the sugar and ⅛ teaspoon salt. Bring to a boil, then reduce the heat to medium and cook until the sauce is nicely thickened, about 5 minutes.
3. Add the remaining 1½ tablespoons oil to the skillet and set heat to medium. Add the onions and cook, stirring occasionally, until softened, about 5 minutes. Stir in the garlic, ginger and remaining 1½ teaspoons curry powder and cook until fragrant, about a minute more.
3. Reduce the heat to medium-low. Add the bell pepper, leek, garlic, and ginger, and stir to combine. Cook for 2 minutes, until slightly softened.
2. Heat 1½ tablespoons of oil in a 12-inch skillet over high heat until just smoking. Add the chicken in a single layer and cook, stirring occasionally, until lightly browned but still pink in spots, about 3 minutes. Transfer the partially cooked chicken to a clean bowl and set aside.
4. Stir in the curry paste. Cook for 5 additional minutes, stirring often. Slowly pour in the coconut milk while stirring to combine. Return the reserved chicken to the skillet.","Summary of Curry Chicken Recipes:
Ingredients:

Chicken: Boneless, skinless chicken breasts or thighs
Vegetables: Onion, garlic, ginger, bell pepper, leek, tomato
Spices and Seasonings: Curry powder, cinnamon, paprika, bay leaf, cayenne pepper, salt, pepper, coriander, cumin, turmeric, fennel seeds, mustard, cloves, red pepper flakes
Liquids: Olive oil or vegetable oil, coconut milk, chicken broth, yogurt, lemon juice, heavy cream
Optional Additions: Tomato paste, sugar, fresh herbs (cilantro, basil, mint), frozen peas
Instructions:

Prepare Ingredients: Chop vegetables, mince garlic and ginger, cut chicken into bite-sized pieces or strips, and measure out spices.
Cook Aromatics: Heat oil in a large skillet over medium heat. Sauté onion until lightly browned. Add garlic, ginger, and spices, and cook until fragrant.
Add Chicken: Add chicken pieces to the skillet, stir in tomato paste if using, and cook until chicken starts to change color.
Add Liquids: Pour in coconut milk, chicken broth, or a combination. Bring to a boil, then reduce heat to simmer. Add yogurt or cream towards the end of cooking.
Simmer: Let the mixture simmer until chicken is cooked through and sauce thickens. Add vegetables like peas or bell peppers as needed.
Finish: Stir in lemon juice, fresh herbs, and additional seasoning. Serve hot over rice.
This summary captures the essential steps and common ingredients across the provided curry chicken recipes while ensuring conciseness and clarity."
